{
  "version": "1.0.1",
  "locked": true,
  "styles": {
    "person": {
      "fill": "#08427B",
      "stroke": "#073B6F",
      "color": "#ffffff",
      "shape": "actor",
      "font_size": 14,
      "font_weight": "normal"
    },
    "system": {
      "fill": "#1168BD",
      "stroke": "#0E5FA3",
      "color": "#ffffff",
      "shape": "box",
      "font_size": 14,
      "font_weight": "bold"
    },
    "container": {
      "fill": "#2874A6",
      "stroke": "#236898",
      "color": "#ffffff",
      "shape": "box",
      "font_size": 13,
      "font_weight": "normal"
    },
    "component": {
      "fill": "#85BBE0",
      "stroke": "#78A8CC",
      "color": "#000000",
      "shape": "box",
      "font_size": 12,
      "font_weight": "normal"
    }
  },
  "relationship_style": {
    "stroke": "#707070",
    "stroke_width": 1.5,
    "arrow_end": "open"
  }
}
